id,active,attachments,bounty,bounty_claim,completed_profile,created_at,current_position,delivery_message,display_boost_factor,expected_finish_date,expertise,fa_icon,full_name,github_link,headline,is_canceled,kind,linkedin_link,location,name,overview,parent,person,photo,points,preferred_name,selectable,send_me_bounties,skill,status,twitter_link,updated_at,user,uuid,website_link
1,,,,,False,2024-05-06T17:34:35.125Z,Python Developer @ OpenUnited,,,,,,Doğukan Teber,,Super lorem ipsum sit amet,,,https://www.linkedin.com/in/dogukanteber/,"New York City, United States",,Super user,,,,,Doğukan,,True,,,https://twitter.com/dogukanteber,2024-05-15T21:22:41.927Z,2,,
2,,,,,False,2024-05-06T17:34:35.136Z,Software Engineer @ Google,,,,,,John Doe,,Experienced Software Engineer with a Passion for AI,,,https://www.linkedin.com/in/johndoe/,"Tokyo, Japan",,I'm a dedicated software engineer with 7 years of experience in building cutting-edge AI solutions. My expertise lies in natural language processing and machine learning algorithms. I have a strong track record of delivering successful projects and collaborating with cross-functional teams. Let's create the future together!,,,,,John,,True,,,https://twitter.com/johndoe,2024-05-06T17:34:35.136Z,3,,
3,,,,,False,2024-05-06T17:34:35.143Z,Senior Graphic Designer @ Apple,,,,,,Emily Smith,,Passionate Graphic Designer with a Love for Typography,,,https://www.linkedin.com/in/emilysmithdesigns/,"London, United Kingdom",,I'm an enthusiastic graphic designer specializing in typography and brand identity. I have a keen eye for detail and a deep understanding of design principles. My goal is to create visually stunning and meaningful designs that leave a lasting impact. Let's bring your brand to life through the power of design!,,,,,Emily,,False,,,https://twitter.com/emilysmithdesigns,2024-05-06T17:34:35.143Z,4,,
4,,,,,False,2024-05-06T17:34:35.147Z,Financial Advisor @ Morgan Stanley,,,,,,Michael Johnson,,Certified Public Accountant (CPA) with a Focus on Financial Planning,,,https://www.linkedin.com/in/mjohnsoncpa/,"Paris, France",,"I'm a CPA with expertise in financial planning and tax advisory. I have successfully helped numerous individuals and businesses in managing their finances and maximizing their profits. With a strong analytical mindset and attention to detail, I ensure that my clients make the best financial decisions. Let's secure your financial future together!",,,,,Michael,,True,,,https://twitter.com/mjohnson_cpa,2024-05-06T17:34:35.147Z,5,,
5,,,,,False,2024-05-06T17:34:35.149Z,Environmental Researcher @ World Wildlife Fund,,,,,,Sophia Garcia,,Passionate Environmental Scientist and Climate Activist,,,https://www.linkedin.com/in/sophiagarciaenv/,"Istanbul, Turkey",,"I'm an environmental scientist dedicated to studying the impact of climate change on our planet. I actively participate in climate advocacy campaigns to raise awareness about environmental issues. My mission is to promote sustainable practices and protect our fragile ecosystems. Together, we can make a difference!",,,,,Sophia,,False,,,https://twitter.com/sophiagarcia_env,2024-05-06T17:34:35.149Z,6,,
6,,,,,False,2024-05-06T17:34:35.152Z,Freelance Photographer,,,,,,William Anderson,,Travel Enthusiast and Adventure Photographer,,,https://www.linkedin.com/in/williamandersonphoto/,"Sydney, Australia",,"I'm a passionate travel enthusiast and professional photographer. My camera is my constant companion as I explore the world, capturing breathtaking landscapes and unique cultures. Through my photographs, I aim to inspire wanderlust and appreciation for the beauty of our planet. Join me on my journey!",,,,,William,,True,,,https://twitter.com/wanderson_photo,2024-05-06T17:34:35.152Z,7,,
7,,,,,False,2024-05-06T17:34:35.159Z,Yoga Instructor @ Fitness Studio,,,,,,Olivia Brown,,Health and Fitness Enthusiast | Certified Yoga Instructor,,,https://www.linkedin.com/in/oliviayogainstructor/,"Sydney, Australia",,"I'm a health and fitness enthusiast who believes in the power of a balanced lifestyle. As a certified yoga instructor, I promote physical and mental well-being through mindful practices. My aim is to guide individuals on their journey towards a healthier and happier life. Let's embrace wellness together!",,,,,Olivia,,False,,,https://twitter.com/oliviayoga,2024-05-06T17:34:35.159Z,8,,
8,,,,,False,2024-05-06T17:34:35.162Z,Senior Project Manager @ Microsoft,,,,,,James Wilson,,Experienced Project Manager | PMP Certified,,,https://www.linkedin.com/in/jameswilsonpmp/,"Sydney, Australia",,"I'm a results-driven project manager with a proven track record of successfully delivering complex projects on time and within budget. With PMP certification and excellent leadership skills, I excel in managing cross-functional teams and achieving project goals. Let's collaborate and make your projects a resounding success!",,,,,James,,True,,,https://twitter.com/jameswilson_pmp,2024-05-06T17:34:35.162Z,9,,
9,,,,,False,2024-05-06T17:34:35.165Z,UI/UX Designer @ Adobe,,,,,,Emma Lee,,UX/UI Designer with a Passion for User-Centered Design,,,https://www.linkedin.com/in/emmaleeuiux/,"Moscow, Russia",,"I'm a creative UX/UI designer who believes in putting the user at the center of every design decision. With a keen eye for aesthetics and a user-centric approach, I craft intuitive and visually appealing digital experiences. Let's collaborate to create designs that delight users and drive business success!",,,,,Emma,,False,,,https://twitter.com/emmalee_designs,2024-05-06T17:34:35.165Z,10,,
10,,,,,False,2024-05-06T17:34:35.167Z,Software Developer @ Amazon,,,,,,David Nguyen,,Full-stack Software Developer | Building Web Applications,,,https://www.linkedin.com/in/davidnguyendev/,"Moscow, Russia",,"I'm a passionate full-stack software developer with a focus on building scalable and user-friendly web applications. I have expertise in various programming languages and frameworks, and I'm always eager to learn and implement the latest technologies. Let's turn your ideas into robust digital solutions!",,,,,David,,True,,,https://twitter.com/davidnguyen_dev,2024-05-06T17:34:35.167Z,11,,
11,,,,,False,2024-05-06T17:34:35.170Z,Co-founder @ TechRevolution,,,,,,Sarah Graham,,Entrepreneur | Co-founder of Tech Startup,,,https://www.linkedin.com/in/sarahgrahamstartup/,"Moscow, Russia",,"I'm an ambitious entrepreneur and the co-founder of a tech startup focused on revolutionizing e-commerce experiences. With a passion for innovation and problem-solving, I thrive in dynamic environments and enjoy creating disruptive solutions. Let's disrupt the market together!",,,,,Sarah,,False,,,https://twitter.com/sarahgraham_founder,2024-05-06T17:34:35.170Z,12,,
12,,,,,False,2024-05-06T17:34:35.174Z,Product Manager @ Facebook,,,,,,Kevin Miller,,Product Manager | Driving Product Innovation,,,https://www.linkedin.com/in/kevinmillerpm/,"Stockholm, Sweden",,"I'm a strategic product manager with a knack for identifying market opportunities and driving product innovation. With a strong customer focus and data-driven approach, I have successfully launched products that resonate with users. Let's work together to create products that leave a lasting impact!",,,,,Kevin,,True,,,https://twitter.com/kevinmiller_pm,2024-05-06T17:34:35.175Z,13,,
13,,,,,False,2024-05-06T17:34:35.182Z,UI/UX Designer @ Google,,,,,,Jessica Lopez,,UI/UX Designer | Crafting Beautiful and Intuitive Interfaces,,,https://www.linkedin.com/in/jessicalopezuiux/,"Stockholm, Sweden",,"I'm a creative UI/UX designer passionate about crafting beautiful and intuitive interfaces that enhance user experiences. With a background in psychology, I understand user behavior and design with empathy. Let's create digital experiences that resonate with users and drive engagement!",,,,,Jessica,,False,,,https://twitter.com/jessicalopez_ui,2024-05-06T17:34:35.182Z,14,,
14,,,,,False,2024-05-06T17:34:35.185Z,Development Manager @ Microsoft,,,,,,Alex Robinson,,Software Development Manager | Leading High-Performing Teams,,,https://www.linkedin.com/in/alexrobinsondev/,"Stockholm, Sweden",,"I'm a seasoned software development manager with a track record of leading high-performing teams in delivering successful projects. With a focus on mentorship and continuous improvement, I foster a collaborative work environment that drives innovation. Let's build exceptional software together!",,,,,Alex,,True,,,https://twitter.com/alexrobinson_dev,2024-05-06T17:34:35.185Z,15,,
15,,,,,False,2024-05-06T17:34:35.189Z,Digital Marketing Specialist @ Twitter,,,,,,Amanda Baker,,Digital Marketing Specialist | Driving Online Growth,,,https://www.linkedin.com/in/amandabakerdigmar/,"Stockholm, Sweden",,"I'm a data-driven digital marketing specialist with a focus on driving online growth and engagement. From SEO to social media marketing, I utilize a mix of strategies to reach target audiences and boost brand visibility. Let's elevate your digital presence and reach new heights!",,,,,Amanda,,False,,,https://twitter.com/amandabaker_digmar,2024-05-06T17:34:35.189Z,16,,
16,,,,,False,2024-05-06T17:34:35.195Z,Founder & CEO @ ShopNex,,,,,,Mark Taylor,,Founder | Building the Future of E-commerce,,,https://www.linkedin.com/in/marktaylorfounder/,"Stockholm, Sweden",,"As the founder of an ambitious e-commerce startup, I'm on a mission to redefine the online shopping experience. With a strong focus on customer satisfaction and technological innovation, our platform aims to disrupt the market and empower sellers. Let's shape the future of e-commerce together!",,,,,Mark,,True,,,https://twitter.com/marktaylor_founder,2024-05-06T17:34:35.195Z,17,,
17,,,,,False,2024-05-06T17:34:35.197Z,Frontend Developer @ Shopify,,,,,,Grace Hernandez,,Frontend Developer | Crafting Pixel-Perfect Interfaces,,,https://www.linkedin.com/in/gracehernandezfe/,"Vienna, Austria",,"I'm a frontend developer with a passion for crafting pixel-perfect interfaces that bring designs to life. With expertise in modern web technologies, I build responsive and visually appealing websites that deliver exceptional user experiences. Let's turn your designs into interactive realities!",,,,,Grace,,False,,,https://twitter.com/gracehernandez_fe,2024-05-06T17:34:35.197Z,18,,
18,,,,,False,2024-05-06T17:34:35.199Z,Business Development Manager @ Salesforce,,,,,,Robert Allen,,Business Development Manager | Driving Strategic Partnerships,,,https://www.linkedin.com/in/robertallenbdm/,"Vienna, Austria",,"I'm a business development manager with a proven track record of driving strategic partnerships and expanding market reach. With strong negotiation and communication skills, I excel in building mutually beneficial relationships. Let's forge valuable partnerships to drive business growth!",,,,,Robert,,True,,,https://twitter.com/robertallen_bdm,2024-05-06T17:34:35.199Z,19,,
19,,,,,False,2024-05-06T17:34:35.203Z,UI Designer @ IBM,,,,,,Rachel Thomas,,UI Designer | Creating Visually Stunning Digital Experiences,,,https://www.linkedin.com/in/rachelthomasui/,"Vienna, Austria",,"I'm a talented UI designer dedicated to creating visually stunning and intuitive digital experiences. With a strong focus on user research and design thinking, I ensure that every detail is carefully considered. Let's collaborate to craft remarkable designs that leave a lasting impression!",,,,,Rachel,,False,,,https://twitter.com/rachelthomas_ui,2024-05-06T17:34:35.203Z,20,,
20,,,,,False,2024-05-06T17:34:35.207Z,Backend Developer @ Netflix,,,,,,Daniel Wilson,,Backend Developer | Building Robust Server Applications,,,https://www.linkedin.com/in/danielwilsonbe/,"Vienna, Austria",,"I'm a skilled backend developer with a focus on building robust server applications that power modern web services. With expertise in database design and optimization, I ensure high-performance and scalability. Let's create a powerful backend for your next big project!",,,,,Daniel,,True,,,https://twitter.com/danielwilson_be,2024-05-06T17:34:35.207Z,21,,
21,,,,,False,2024-05-06T17:34:35.211Z,Content Strategist @ BuzzFeed,,,,,,Michelle Carter,,Content Strategist | Crafting Engaging Digital Narratives,,,https://www.linkedin.com/in/michellecartercs/,"Vienna, Austria",,"I'm a creative content strategist with a passion for crafting engaging digital narratives that resonate with audiences. From brand storytelling to social media campaigns, I use storytelling to connect with customers. Let's captivate your audience with compelling content!",,,,,Michelle,,False,,,https://twitter.com/michellecarter_cs,2024-05-06T17:34:35.211Z,22,,
22,,,,,False,2024-05-06T17:34:35.214Z,Data Scientist @ Airbnb,,,,,,Andrew Wong,,Data Scientist | Turning Data into Insights,,,https://www.linkedin.com/in/andrewwongdatasci/,"Prague, Czech Republic",,"I'm a data scientist with a passion for turning raw data into actionable insights. With expertise in statistical analysis and machine learning, I extract valuable patterns from data. Let's leverage data-driven decisions to optimize your business!",,,,,Andrew,,True,,,https://twitter.com/andrewwong_datasci,2024-05-06T17:34:35.214Z,23,,
23,,,,,False,2024-05-06T17:34:35.217Z,Social Media Manager @ Coca-Cola,,,,,,Natalie Parker,,Social Media Manager | Building Online Communities,,,https://www.linkedin.com/in/natalieparkersmm/,"Prague, Czech Republic",,"I'm a social media manager specializing in building online communities and fostering brand engagement. From content creation to influencer marketing, I drive brand awareness and customer loyalty. Let's create a vibrant community around your brand!",,,,,Natalie,,False,,,https://twitter.com/natalieparker_smm,2024-05-06T17:34:35.217Z,24,,
24,,,,,False,2024-05-06T17:34:35.219Z,Frontend Developer @ Microsoft,,,,,,Jason Miller,,Frontend Developer | Creating Seamless User Experiences,,,https://www.linkedin.com/in/jasonmillerfe/,"Prague, Czech Republic",,"I'm a frontend developer with a passion for creating seamless user experiences across devices. With a focus on responsive design and performance optimization, I ensure that your web applications delight users. Let's build delightful user interfaces together!",,,,,Jason,,True,,,https://twitter.com/jasonmiller_fe,2024-05-06T17:34:35.219Z,25,,
25,,,,,False,2024-05-06T17:34:35.225Z,Marketing Manager @ Amazon,,,,,,Samantha White,,Marketing Manager | Driving Growth Through Innovative Strategies,,,https://www.linkedin.com/in/samanthawhitemktg/,"Prague, Czech Republic",,"I'm a dynamic marketing manager with a focus on driving growth through innovative strategies. From product launches to omnichannel campaigns, I lead marketing initiatives that generate impactful results. Let's elevate your brand to new heights!",,,,,Samantha,,False,,,https://twitter.com/samanthawhite_mktg,2024-05-06T17:34:35.225Z,26,,
26,,,,,False,2024-05-06T17:34:35.227Z,DevOps Engineer @ Google,,,,,,Christopher Lee,,DevOps Engineer | Automating Continuous Deployment,,,https://www.linkedin.com/in/christopherleedevops/,"Prague, Czech Republic",,"I'm a seasoned DevOps engineer with a focus on automating continuous deployment and streamlining operations. From infrastructure as code to containerization, I optimize development workflows. Let's boost your team's productivity and delivery speed!",,,,,Christopher,,True,,,https://twitter.com/christopherlee_devops,2024-05-06T17:34:35.227Z,27,,
27,,,,,False,2024-05-06T17:34:35.231Z,UX Researcher @ Apple,,,,,,Melissa Chen,,UX Researcher | Uncovering User Insights,,,https://www.linkedin.com/in/melissachenux/,"Prague, Czech Republic",,"I'm a UX researcher passionate about uncovering user insights to inform product design. From usability testing to user interviews, I gather valuable data for user-centered decision-making. Let's create products that resonate with your target audience!",,,,,Melissa,,False,,,https://twitter.com/melissachen_ux,2024-05-06T17:34:35.231Z,28,,
28,,,,,False,2024-05-06T17:34:35.233Z,Sales Manager @ Salesforce,,,,,,Jonathan Murphy,,Sales Manager | Driving Revenue Growth,,,https://www.linkedin.com/in/jonathanmurphysales/,"Istanbul, Turkey",,"I'm a results-oriented sales manager with a track record of driving revenue growth and leading high-performing sales teams. From strategic planning to pipeline management, I optimize sales processes. Let's achieve unprecedented sales success!",,,,,Jonathan,,True,,,https://twitter.com/jonathanmurphy_sales,2024-05-06T17:34:35.233Z,29,,
29,,,,,False,2024-05-06T17:34:35.235Z,Product Designer @ Microsoft,,,,,,Stephanie Allen,,Product Designer | Innovating User-Centric Solutions,,,https://www.linkedin.com/in/stephanieallenprod/,"Istanbul, Turkey",,"I'm a creative product designer committed to innovating user-centric solutions that solve real-world problems. From concept ideation to prototyping, I turn ideas into tangible products. Let's design products that make a positive impact!",,,,,Stephanie,,False,,,https://twitter.com/stephanieallen_prod,2024-05-06T17:34:35.235Z,30,,
30,,,,,False,2024-05-06T17:34:35.241Z,Data Engineer @ Netflix,,,,,,Brandon Perez,,Data Engineer | Building Scalable Data Pipelines,,,https://www.linkedin.com/in/brandonperezdata/,"Istanbul, Turkey",,"I'm a data engineer specialized in building scalable and efficient data pipelines. From data modeling to ETL processes, I ensure data integrity and availability. Let's empower your business with data-driven insights!",,,,,Brandon,,True,,,https://twitter.com/brandonperez_data,2024-05-06T17:34:35.241Z,31,,
31,,,,,False,2024-05-06T17:34:35.244Z,Content Writer @ The New York Times,,,,,,Amy Turner,,Content Writer | Crafting Compelling Stories,,,https://www.linkedin.com/in/amyturnerwriter/,"Istanbul, Turkey",,"I'm a talented content writer passionate about crafting compelling stories that resonate with audiences. From blog posts to brand narratives, I use the power of words to connect with readers. Let's tell your brand's story in a captivating way!",,,,,Amy,,False,,,https://twitter.com/amyturner_writer,2024-05-06T17:34:35.244Z,32,,
32,,,,,False,2024-05-06T17:34:35.247Z,Software Architect @ Microsoft,,,,,,Ryan Flores,,Software Architect | Designing Scalable Systems,,,https://www.linkedin.com/in/ryanfloresarch/,"Istanbul, Turkey",,"I'm a software architect with a focus on designing scalable and resilient systems. From system architecture to performance optimization, I ensure that software meets the highest standards. Let's build a strong foundation for your applications!",,,,,Ryan,,True,,,https://twitter.com/ryanflores_arch,2024-05-06T17:34:35.247Z,33,,
33,,,,,False,2024-05-06T17:34:35.250Z,Digital Strategist @ Google,,,,,,Lauren Barnes,,Digital Strategist | Maximizing Online Presence,,,https://www.linkedin.com/in/laurenbarnesds/,"Istanbul, Turkey",,"I'm a digital strategist focused on maximizing online presence and driving customer engagement. From SEO to online advertising, I create data-driven strategies that deliver tangible results. Let's take your digital presence to the next level!",,,,,Lauren,,False,,,https://twitter.com/laurenbarnes_ds,2024-05-06T17:34:35.250Z,34,,
34,,,,,False,2024-05-06T17:34:35.252Z,Mobile App Developer @ Apple,,,,,,Eric Rivera,,Mobile App Developer | Creating Intuitive Mobile Experiences,,,https://www.linkedin.com/in/ericriveramobile/,"Mumbai, India",,"I'm a mobile app developer passionate about creating intuitive and feature-rich mobile experiences. With expertise in iOS and Android development, I build apps that users love. Let's turn your app ideas into reality!",,,,,Eric,,True,,,https://twitter.com/ericrivera_mobile,2024-05-06T17:34:35.252Z,35,,
35,,,,,False,2024-05-06T17:34:35.256Z,UI Designer @ Adobe,,,,,,Hannah Cooper,,UI Designer | Crafting Aesthetically Pleasing Interfaces,,,https://www.linkedin.com/in/hannahcooperui/,"Mumbai, India",,"I'm a skilled UI designer dedicated to crafting aesthetically pleasing and user-friendly interfaces. With a passion for typography and color theory, I create visually appealing designs that delight users. Let's make your interfaces stand out!",,,,,Hannah,,False,,,https://twitter.com/hannahcooper_ui,2024-05-06T17:34:35.256Z,36,,
36,,,,,False,2024-05-06T17:34:35.259Z,Business Analyst @ Amazon,,,,,,Patrick Young,,Business Analyst | Uncovering Insights for Decision-Making,,,https://www.linkedin.com/in/patrickyoungba/,"Mumbai, India",,"I'm a business analyst specialized in uncovering insights from data to inform strategic decision-making. With expertise in data visualization and market research, I empower businesses with actionable intelligence. Let's make data-driven decisions together!",,,,,Patrick,,True,,,https://twitter.com/patrickyoung_ba,2024-05-06T17:34:35.259Z,37,,
37,,,,,False,2024-05-06T17:34:35.263Z,Graphic Designer @ Nike,,,,,,Olivia Hill,,Graphic Designer | Creating Visually Stunning Graphics,,,https://www.linkedin.com/in/oliviahilldesign/,"Mumbai, India",,"I'm a creative graphic designer committed to creating visually stunning graphics that communicate brand messages effectively. From logos to marketing materials, I deliver captivating designs that leave a lasting impression. Let's bring your brand to life!",,,,,Olivia,,False,,,https://twitter.com/oliviahill_design,2024-05-06T17:34:35.263Z,38,,
38,,,,,False,2024-05-06T17:34:35.265Z,Software Tester @ Microsoft,,,,,,Matthew Martin,,Software Tester | Ensuring Product Quality,,,https://www.linkedin.com/in/matthewmartintest/,"Mumbai, India",,"I'm a meticulous software tester dedicated to ensuring product quality and usability. From test planning to bug tracking, I ensure that software meets the highest standards. Let's deliver flawless software to your users!",,,,,Matthew,,True,,,https://twitter.com/matthewmartin_test,2024-05-06T17:34:35.265Z,39,,
39,,,,,False,2024-05-06T17:34:35.265Z,,,,,,,Pacey Witter,,,,,,,,,,,,,Pacey,,True,,,,2024-05-06T17:34:35.265Z,40,,
40,,,,,False,2024-05-06T17:34:35.265Z,,,,,,,Regina George,,,,,,,,,,,,,Regina,,True,,,,2024-05-06T17:34:35.265Z,41,,
1,,,,,,,,,,,,,,,,,,,,Drone,,,1,,0,,,,,,,,,,
2,,,,,,,,,,,,,,,,,,,,Drone,,,2,,0,,,,,,,,,,
3,,,,,,,,,,,,,,,,,,,,Drone,,,3,,0,,,,,,,,,,
4,,,,,,,,,,,,,,,,,,,,Drone,,,4,,0,,,,,,,,,,
5,,,,,,,,,,,,,,,,,,,,Drone,,,5,,0,,,,,,,,,,
6,,,,,,,,,,,,,,,,,,,,Drone,,,6,,0,,,,,,,,,,
7,,,,,,,,,,,,,,,,,,,,Drone,,,7,,0,,,,,,,,,,
8,,,,,,,,,,,,,,,,,,,,Drone,,,8,,0,,,,,,,,,,
9,,,,,,,,,,,,,,,,,,,,Drone,,,9,,0,,,,,,,,,,
10,,,,,,,,,,,,,,,,,,,,Drone,,,10,,0,,,,,,,,,,
11,,,,,,,,,,,,,,,,,,,,Trusted Bee,,,11,,790,,,,,,,,,,
12,,,,,,,,,,,,,,,,,,,,Trusted Bee,,,12,,968,,,,,,,,,,
13,,,,,,,,,,,,,,,,,,,,Trusted Bee,,,13,,952,,,,,,,,,,
14,,,,,,,,,,,,,,,,,,,,Trusted Bee,,,14,,822,,,,,,,,,,
15,,,,,,,,,,,,,,,,,,,,Trusted Bee,,,15,,1012,,,,,,,,,,
16,,,,,,,,,,,,,,,,,,,,Drone,,,16,,0,,,,,,,,,,
17,,,,,,,,,,,,,,,,,,,,Drone,,,17,,0,,,,,,,,,,
18,,,,,,,,,,,,,,,,,,,,Trusted Bee,,,18,,886,,,,,,,,,,
19,,,,,,,,,,,,,,,,,,,,Trusted Bee,,,19,,922,,,,,,,,,,
20,,,,,,,,,,,,,,,,,,,,Drone,,,20,,0,,,,,,,,,,
21,,,,,,,,,,,,,,,,,,,,Drone,,,21,,0,,,,,,,,,,
22,,,,,,,,,,,,,,,,,,,,Drone,,,22,,0,,,,,,,,,,
23,,,,,,,,,,,,,,,,,,,,Drone,,,23,,0,,,,,,,,,,
24,,,,,,,,,,,,,,,,,,,,Drone,,,24,,0,,,,,,,,,,
25,,,,,,,,,,,,,,,,,,,,Drone,,,25,,0,,,,,,,,,,
26,,,,,,,,,,,,,,,,,,,,Drone,,,26,,0,,,,,,,,,,
27,,,,,,,,,,,,,,,,,,,,Drone,,,27,,0,,,,,,,,,,
28,,,,,,,,,,,,,,,,,,,,Drone,,,28,,0,,,,,,,,,,
29,,,,,,,,,,,,,,,,,,,,Drone,,,29,,0,,,,,,,,,,
30,,,,,,,,,,,,,,,,,,,,Drone,,,30,,0,,,,,,,,,,
31,,,,,,,,,,,,,,,,,,,,Drone,,,31,,0,,,,,,,,,,
32,,,,,,,,,,,,,,,,,,,,Drone,,,32,,0,,,,,,,,,,
33,,,,,,,,,,,,,,,,,,,,Drone,,,33,,0,,,,,,,,,,
34,,,,,,,,,,,,,,,,,,,,Drone,,,34,,0,,,,,,,,,,
35,,,,,,,,,,,,,,,,,,,,Drone,,,35,,0,,,,,,,,,,
36,,,,,,,,,,,,,,,,,,,,Drone,,,36,,0,,,,,,,,,,
37,,,,,,,,,,,,,,,,,,,,Drone,,,37,,0,,,,,,,,,,
38,,,,,,,,,,,,,,,,,,,,Drone,,,38,,0,,,,,,,,,,
39,,,,,,,,,,,,,,,,,,,,Honeybee,,,39,,71,,,,,,,,,,
40,,,,,,,,,,,,,,,,,,,,Honeybee,,,40,,71,,,,,,,,,,
1,,,,,,,,,,,[2],,,,,,,,,,,,2,,,,,,92,,,,,,
2,,,,,,,,,,,[4],,,,,,,,,,,,3,,,,,,93,,,,,,
3,,,,,,,,,,,"[6, 7, 8, 10, 11]",,,,,,,,,,,,39,,,,,,94,,,,,,
4,,,,,,,,,,,"[13, 14, 16, 17, 19, 20, 21]",,,,,,,,,,,,40,,,,,,97,,,,,,
5,,,,,,,,,,,"[16, 17, 13, 14]",,,,,,,,,,,,39,,,,,,97,,,,,,
6,,,,,,,,,,,"[23, 24, 25, 27, 28]",,,,,,,,,,,,1,,,,,,105,,,,,,
7,,,,,,,,,,,[33],,,,,,,,,,,,39,,,,,,106,,,,,,
8,,,,,,,,,,,[35],,,,,,,,,,,,1,,,,,,114,,,,,,
1,False,,,,,,,,1,,,,,,,,,,,Art & Creative,,,,,,,False,,,,,,,,
2,False,,,,,,,,1,,,,,,,,,,,2D Animation,,1,,,,,False,,,,,,,,
3,False,,,,,,,,1,,,,,,,,,,,Acting,,1,,,,,False,,,,,,,,
4,False,,,,,,,,1,,,,,,,,,,,AR/VR Design,,1,,,,,False,,,,,,,,
5,False,,,,,,,,1,,,,,,,,,,,Art Direction,,1,,,,,False,,,,,,,,
6,False,,,,,,,,1,,,,,,,,,,,Audio Editing,,1,,,,,False,,,,,,,,
7,False,,,,,,,,1,,,,,,,,,,,Audio Production,,1,,,,,False,,,,,,,,
8,False,,,,,,,,1,,,,,,,,,,,Brand Design,,1,,,,,False,,,,,,,,
9,False,,,,,,,,1,,,,,,,,,,,Caricatures & Portraits,,1,,,,,False,,,,,,,,
10,False,,,,,,,,1,,,,,,,,,,,Cartoons & Comics,,1,,,,,False,,,,,,,,
11,False,,,,,,,,1,,,,,,,,,,,Creative Direction,,1,,,,,False,,,,,,,,
12,False,,,,,,,,1,,,,,,,,,,,Editorial Design,,1,,,,,False,,,,,,,,
13,False,,,,,,,,1,,,,,,,,,,,Game Art,,1,,,,,False,,,,,,,,
14,False,,,,,,,,1,,,,,,,,,,,Local Photography,,1,,,,,False,,,,,,,,
15,False,,,,,,,,1,,,,,,,,,,,Motion Graphics,,1,,,,,False,,,,,,,,
16,False,,,,,,,,1,,,,,,,,,,,Image Editing,,1,,,,,False,,,,,,,,
17,False,,,,,,,,1,,,,,,,,,,,Music Composition,,1,,,,,False,,,,,,,,
18,False,,,,,,,,1,,,,,,,,,,,Music Production,,1,,,,,False,,,,,,,,
19,False,,,,,,,,1,,,,,,,,,,,Musician,,1,,,,,False,,,,,,,,
20,False,,,,,,,,1,,,,,,,,,,,Packaging Design,,1,,,,,False,,,,,,,,
21,False,,,,,,,,1,,,,,,,,,,,Pattern Design,,1,,,,,False,,,,,,,,
22,False,,,,,,,,1,,,,,,,,,,,Presentation Design,,1,,,,,False,,,,,,,,
23,False,,,,,,,,1,,,,,,,,,,,Product & Industrial Design,,1,,,,,False,,,,,,,,
24,False,,,,,,,,1,,,,,,,,,,,Product Photography,,1,,,,,False,,,,,,,,
25,False,,,,,,,,1,,,,,,,,,,,Video Editing,,1,,,,,False,,,,,,,,
