id,name,description,status,video_url,product_id
AHmdsRxSU6Jet3UTZ56jdK,Mobile App Redesign,Redesign our mobile app for better user experience,In Progress,https://youtu.be/app-redesign,3trKw35JC6kqiiJMGaoET7
HatbktHJ391RdN6Nsji3xT,AI-Powered Recommendations,Implement AI algorithms for personalized recommendations,Planning,https://youtu.be/ai-recommendations,Qrr881rBrVcXuUPD9rfpAu
Grjar72Jnoqr39eT1oLTUY,Cloud Migration,Migrate our infrastructure to the cloud for better scalability,Completed,https://youtu.be/cloud-migration,QgNWurbk6QANXZ58ZbsiPw
8Pxv1tXfR4YigFCDsBjSjP,Security Enhancement,Improve overall system security and implement new encryption methods,In Progress,https://youtu.be/security-enhancement,V1b3PhSKcjj4FpkUG7oajm
45zsqkdk3PXRxzjS1MEvhW,Performance Optimization,Optimize database queries and frontend rendering,Planning,https://youtu.be/performance-optimization,NCyQd9sJjzktabhFok9Q2W
